Function,Failure_Mode,Effect,S,Cause,O,Current_Controls,D,RPN,Recommended_Action,Nerves_Pi_Impact,Residual_RPN_with_Nerves
Alerting (email/SMS delivery),Email delivery fails silently (SMTP error not surfaced to operator),Critical alerts (valve stuck open; critical dry) not received; operator unaware of emergency,9,SMTP server unreachable; credentials expired; spam filter blocking; email.enabled = false accidentally,4,Alert always written to alert_logs table in SQLite regardless of email delivery; Elixir Logger records SMTP error; dashboard logs page shows all alerts,6,216,Add alert delivery confirmation: if SMTP send fails log as delivery_failure in alert_logs; add periodic health-check email (daily "system alive"); surface delivery failures on dashboard,Minor,108
Alerting (email/SMS delivery),SMS delivery fails silently (Twilio API error),Critical SMS alert not received; operator unaware of flooding or extreme dryness during off-hours,9,Twilio account credit exhausted; API credentials revoked; no internet from central server,4,Alert always written to alert_logs table; Logger records HTTP error; Twilio returns status code checked in code,6,216,Add delivery confirmation flag in alert_logs; alert operator via email if SMS fails; monitor Twilio account balance; add test SMS on schedule,Minor,108
Shared sensing (DHT22 — temperature/humidity/VPD),DHT22 reads plausible but wrong values (drift/offset),VPD calculated incorrectly; watering decisions skewed; no alert fires,5,Sensor aging; condensation on element; slow drift,5,No plausibility check on DHT22 readings; sensor_ok only flags hard failure,8,200,Add cross-check against leaf_temp from MLX90614 (air_temp and leaf_temp should track within reasonable bounds); alert on sustained implausible delta,Major,80
Site WAN comms (4G router),4G data cap / SIM credit exhausted,Site goes completely dark; same effect as 4G link drop; zone_offline alerts fire,7,Unmonitored SIM data usage; high OTA firmware upload consuming quota; spike in sensor frequency,4,No existing control for SIM credit monitoring,7,196,Set up SIM data usage alerts with carrier; use fixed-line backup where available; reduce OTA binary size; monitor monthly data usage,Minor,140
ESP32 microcontroller,ESP32 local autonomous watering logic applies wrong thresholds,Plants over- or under-watered during comms outage; incorrect thresholds baked into firmware,6,Hardcoded thresholds in firmware not matching current site conditions; firmware not updated,5,Dripper learning adapts over time; OTA update mechanism exists to push corrected firmware; server commands override local logic when online,6,180,Expose threshold config via MQTT topic so server can push updated thresholds; add threshold validation in firmware,Major,54
Data persistence (SQLite),Disk full — writes fail silently,Sensor readings stop being saved; watering events not recorded; alerting may partially fail; data gap in history,6,Unbounded growth of sensor_readings table (every 30s per zone); no retention policy,4,SQLite WAL mode; Ecto returns errors on failed writes — but no alert is raised to operator,7,168,Implement data retention policy (e.g. purge readings older than 6 months); add disk-space monitoring with alert; log DB write failures as alerts,Significant,63
Valve control (relay + solenoid),Relay contacts weld shut (relay stuck closed),Valve cannot be de-energised; continuous watering regardless of commands; flooding risk,9,Relay contact arcing on inductive solenoid load; undersized relay; lack of flyback diode,3,ZoneServer watchdog detects valve open >120s and sends stop command; stop command reaches relay but relay cannot open; zone_offline alert if ESP32 also fails; NC solenoid safe on total power loss,6,162,Add flyback diode across each solenoid coil; size relay correctly for inductive load; add flow sensor; add moisture ceiling alert; annual relay inspection,Significant,81
Site WAN comms (4G router),4G link drops completely,Server loses all data from site; ZoneServer detects zone offline after 30 min and alerts; ESP32 continues autonomous watering; no real-time visibility; no remote valve control,7,4G carrier outage; router fault; SIM credit exhausted; antenna issue,5,ZoneServer 30-min timeout fires zone_offline alert; ESP32 local fallback mode; NC solenoids safe on power loss,4,140,Add Nerves Pi at site to buffer data locally and sync on reconnect; dual-SIM or secondary WiFi backup router; SIM credit auto top-up,Major,35
Shared sensing (MLX90614 — IR leaf temp),MLX90614 reads incorrect leaf temp (dirty lens / wrong emissivity),Leaf temp data inaccurate; VPD skewed; watering decisions degraded; no alert fires,4,Dust or water on lens; emissivity not calibrated for specific plant leaf,5,No plausibility check; sensor_ok only flags hard I2C failure,7,140,Add plausibility check: leaf_temp should be within ±15°C of air_temp for typical plants; alert if persistently outside bounds,Significant,56
Dashboard/operator access,BasicAuth credentials exposed or weak,Unauthorised access to dashboard; operator commands (water/stop) can be issued by attacker; settings (SMTP credentials) visible,7,Weak default credentials not changed before deployment; credentials shared insecurely; HTTP (not HTTPS) in use,3,BasicAuth + settings password required to save settings; documented in config as must-change before go-live,6,126,Enforce HTTPS; rotate credentials; consider IP allowlist; document credential rotation procedure; add settings_password strength check,None,126
Valve control (relay + solenoid),Solenoid valve stuck mechanically closed (no water delivered),Plants dry out; critical_dry alert fires at <=10% moisture; dripper learning flags dripper_fault after 3 failed baselines,7,Debris blockage; failed solenoid coil; wiring break to solenoid,4,Dripper learning detects lack of moisture rise after watering and sets dripper_fault after 3 events; critical_dry alert fires at <=10% moisture; ESP32 local fallback still attempts watering,4,112,Inspect and flush solenoids on maintenance schedule; dripper_fault alert should trigger immediate email+SMS; consider flow sensor,Significant,56
Central server (PC running everything),PC crashes or OS locks up (BSOD / hang),All monitoring and alerting stops across every site; MQTT broker goes down; no commands can be sent; valves cannot be stopped remotely; no alerts fire,9,Windows instability / hardware fault / BSOD; unattended PC,4,BEAM supervision restarts Elixir processes after crash; NC solenoids fail-closed on power loss; ESP32 local fallback continues autonomous watering,3,108,Move to dedicated always-on Linux host or Raspberry Pi; configure OS watchdog; UPS with auto-shutdown; monitoring from external health-check service,Major,36
Central server (PC running everything),PC power loss (no UPS),Mosquitto + Elixir + SQLite all go offline simultaneously; ESP32s lose MQTT contact and fall back to local mode; no remote alerting; NC solenoids safe-close on power loss,9,Mains power failure; no UPS fitted,4,NC solenoids fail safe; ESP32 autonomous fallback,3,108,Fit UPS to central PC; configure Mosquitto and Elixir as auto-start services; test recovery procedure,Major,36
Data persistence (SQLite),SQLite database file corruption,Historical sensor data and watering events lost or inaccessible; dashboard may error; alerting log broken,7,Unclean shutdown during write; disk full; filesystem error on Windows,3,SQLite WAL mode reduces corruption risk; Ecto handles DB errors gracefully; alert log also written to memory,5,105,Add daily automated SQLite backup to second location (network share or cloud); monitor disk free space; run PRAGMA integrity_check on startup,Significant,42
